<?xml version="1.0" encoding="UTF-8"?>

<xs:schema
    xmlns:xs="http://www.w3.org/2001/XMLSchema"
    targetNamespace="http://example.org/animation-schema"
    xmlns="http://example.org/animation-schema"
    elementFormDefault="qualified">

    <xs:annotation>
        <xs:documentation>
            Animation Film Metadata Schema.
            This schema is designed to describe animated films for discovery,
            management, comparison, and research use. It combines general film
            metadata elements with animation-specific elements such as animation
            style, theme, music director, character designer, and series relation.
        </xs:documentation>
    </xs:annotation>

    <xs:simpleType name="GenreType">
        <xs:annotation>
            <xs:documentation>
                Controlled vocabulary for the main genre category of an animated film.
            </xs:documentation>
        </xs:annotation>
        <xs:restriction base="xs:string">
            <xs:enumeration value="Fantasy"/>
            <xs:enumeration value="Adventure"/>
            <xs:enumeration value="Romance"/>
        </xs:restriction>
    </xs:simpleType>

    <xs:simpleType name="AnimationStyleType">
        <xs:annotation>
            <xs:documentation>
                Controlled vocabulary for the visual or production style of animation.
            </xs:documentation>
        </xs:annotation>
        <xs:restriction base="xs:string">
            <xs:enumeration value="Anime"/>
            <xs:enumeration value="2D Animation"/>
            <xs:enumeration value="3D Animation"/>
            <xs:enumeration value="Stop Motion"/>
            <xs:enumeration value="Claymation"/>
            <xs:enumeration value="Cut-out Animation"/>
        </xs:restriction>
    </xs:simpleType>

    <xs:simpleType name="ThemeType">
        <xs:annotation>
            <xs:documentation>
                Controlled vocabulary for the main themes represented in the film.
            </xs:documentation>
        </xs:annotation>
        <xs:restriction base="xs:string">
            <xs:enumeration value="Identity"/>
            <xs:enumeration value="Time Travel"/>
            <xs:enumeration value="Friendship"/>
            <xs:enumeration value="Love"/>
            <xs:enumeration value="Courage"/>
            <xs:enumeration value="Family"/>
            <xs:enumeration value="Growth"/>
            <xs:enumeration value="Social Issues"/>
        </xs:restriction>
    </xs:simpleType>

    <xs:element name="animationFilm">
        <xs:annotation>
            <xs:documentation>
                Root element for one animated film metadata record.
                Each record describes one animated film as a complete work.
            </xs:documentation>
        </xs:annotation>

        <xs:complexType>
            <xs:sequence>
                <xs:element name="title" type="xs:string"/>
                <xs:element name="director" type="xs:string" maxOccurs="unbounded"/>
                <xs:element name="date" type="xs:gYear"/>
                <xs:element name="genre" type="GenreType" maxOccurs="unbounded"/>
                <xs:element name="description" type="xs:string" minOccurs="0"/>
                <xs:element name="animationStyle" type="AnimationStyleType" maxOccurs="unbounded"/>
                <xs:element name="duration" type="xs:string"/>
                <xs:element name="inLanguage" type="xs:string" maxOccurs="unbounded"/>
                <xs:element name="theme" type="ThemeType" minOccurs="0" maxOccurs="unbounded"/>
                <xs:element name="productionCompany" type="xs:string" maxOccurs="unbounded"/>
                <xs:element name="musicDirector" type="xs:string" minOccurs="0" maxOccurs="unbounded"/>
                <xs:element name="characterDesigner" type="xs:string" minOccurs="0" maxOccurs="unbounded"/>
                <xs:element name="isPartOf" type="xs:string" minOccurs="0"/>
            </xs:sequence>
        </xs:complexType>
    </xs:element>

</xs:schema>
