<?xml version="1.0" encoding="UTF-8"?>

<animationFilm
    xmlns="http://example.org/animation-schema"
    xmlns:xsi="http://www.w3.org/2001/XMLSchema-instance"
    xsi:schemaLocation="http://example.org/animation-schema animation.xsd">

    <title>Spirited Away</title>
    <director>Hayao Miyazaki</director>
    <date>2001</date>
    <genre>Fantasy</genre>
    <genre>Adventure</genre>
    <description>A young girl enters a mysterious spirit world and tries to save her parents.</description>
    <animationStyle>Anime</animationStyle>
    <duration>PT125M</duration>
    <inLanguage>Japanese</inLanguage>
    <theme>Courage</theme>
    <theme>Growth</theme>
    <productionCompany>Studio Ghibli</productionCompany>
    <musicDirector>Joe Hisaishi</musicDirector>
    <characterDesigner>Hayao Miyazaki</characterDesigner>

</animationFilm>
